{
  "contract_version": "2.0.0",
  "agent": "code-reviewer",
  "kind": "audit",
  "status": "complete",
  "verdict": "approve",
  "positive_observations": [
    "src/utils/format-date.ts:2 usa nullish coalescing explicitamente em `split('T')[0] ?? ''` — boundary case de string vazia tratado"
  ],
  "reasoning": "Funcao formatDate tem responsabilidade unica, nome descritivo e trata o edge case de split retornar undefined com fallback explicito. Nenhum issue de correctness ou readability detectado no trecho auditado.",
  "payload": {
    "domain_status": "clean",
    "issues": []
  },
  "metadata": { "run_id": "test-code-reviewer-001", "duration_ms": 0, "model": "test" }
}
